"id","text","author_username","author_id","created_at","like_count","reply_count","retweet_count","quote_count","bookmark_count","impression_count","lang","conversation_id","hashtags","mentions","x_fetched_at"
"1962795707917836704","@BudiBukanIntel bang bud coba deh tengkok video ini, perihal MBG, yg wadah nya itu dibuat Dari cina Dan bahan bahan nya non foodgrdae
https://t.co/RuZ6deW3q2","est17_","1165482868958609410","2025-09-02 08:32:18","0","0","0","0","0","89","in","1962748206934368644","[]","[""@BudiBukanIntel""]","2025-09-13 16:43:49"
"1969287558590025729","Kalau gue inget-inget pelajaran kimia sewaktu SMA, wajar sih ada hipotesis bahwa food tray yang saat ini banyak digunakan jadi salah satu potensi penyebab keracunan. Kalau ga salah, sebagian tray punya grade stainless steel 201 yang sebenarnya ini tuh kurang tahan sama lingkungan lembab, garam, atau panas tinggi karena kandungan mangan tinggi (5,5–7,5%), nikel rendah (3,5–5,5%), & kromium cuma (16–18%).

Tray MBG sudah pasti tuh kan sering terpapar air, deterjen, & residu makanan, yang secara teknis bisa merusak lapisan oksida kromium. Ada reaksi elektrokimia yaitu Fe + O2 + H2O → Fe(OH)2, alias membentuk Fe2O3 (karat). Hasilnya, timbul proses kontaminasi dari leaching logam di tray ke makanan. Mungkin pemikiran ini salah, tapi—

1. Menu MBG kan kadang ada sayur, buah, atau sausnya, yang sebenarnya itu semua bisa aja bersifat asam. Makanan asam (pH < 4,5, kayak tomat, jeruk, atau cuka) bahkan mempercepat korosi tray 201 melalui reaksi H+ dengan lapisan oksida, bikin leaching ion mangan (Mn), nikel (Ni), & kromium (Cr). Sialnya, mangan berlebih bisa bikin gangguan neurologis (tremor, kekakuan otot), sementara kontaminasi nikel memicu alergi kulit atau masalah pernapasan jangka panjang. Jadi apakah set menu super minimalis yang selama ini membagongkan kita ternyata tujuannya adalah supaya anak-anak ga terkontaminasi berlebih? 😵‍💫

2. Makanan panas (misal nasi atau sup) mengeluarkan energi thermal yang memfasilitasi difusi ion dari matriks logam. Ini bisa mempercepat laju migrasi ion sampai 10 kali lipat. Bisa aja proses ini bikin kemunculan timbal (Pb) yang lebih dari 0,01 mg/kg di tray 201. Kalau kita cek kadar ini sudah melebihi batas aman yang ditetapkan sama BPOM.

3. Kira-kira apa yang biasa kita pakai buat nyuci piring? Yak betul. Spons & sabun cuci piring. Kalau pencucian tray 201 memakai spons abrasif atau deterjen kuat (misal mengandung asam sitrat) maka lapisan pasivasi (Cr2O3) bisa terkikis sehingga mempercepat korosi. Bayangkan kalau ada dapur yang mencuci secara massal tanpa prosedur standar. Goresan atau penyok pada tray bisa bikin area tersebut menjadi anoda dalam sel korosi yang mempercepat leaching.

By the way, karena penerima manfaat MBG adalah anak-anak, maka tingkat kerentanannya lebih besar dan reaksi yang timbul bisa lebih cepat, karena metabolisme anak lebih tinggi dibanding orang dewasa.

Lalu bagaimana dengan kasus keracunan yang disebabkan bakteri kayak Salmonella atau E. Coli? Ini mungkin banget dan bisa kita kategorikan sebagai kontaminasi sekunder dari tray rusak atau treatment bahan makanan yang ga sesuai standar higienis. Cuma untuk kemungkinan ini, variabelnya lebih banyak, termasuk variabel ga terduga kayak tingkat imunitas seseorang.

Jadi gmn dong supaya anak-anak ga keracunan MBG? Jawabannya sungguh sederhana wahai bapak ibu sekalian. Intinya dimulai dengan bangun lebih pagi lagi wkwk.","jisatorio","1414492515143622662","2025-09-20 06:28:36","0","0","0","0","0","12","in","1969287558590025729","[]","[]","2025-09-25 11:10:57"
"1973735096881655992","Satuan Pelayanan Pemenuhan Gizi (SPPG) Slipi, Palmerah, Jakarta Barat, membeberkan cara mencegah terjadinya kejadian luar biasa (KLB) seperti keracunan usai menyantap Makan Bergizi Gratis (MBG).

Koordinator SPPG Wilayah Jakarta Barat, Yudha Permana, menegaskan kunci utama ada pada penerapan Critical Control Point (CCP). Menurutnya, CCP dilakukan tidak ketika bahan baku datang tapi mulai dari pemilihan menu sudah mempertimbangkan Angka Kecukupan Gizi (AKG).

""Jadi di setiap SPPG itu dipastikan bahwa mereka menjaga CCP atau Critical Control Point. Ini mulai dari awal, sebetulnya tidak ketika bahan baku datang saja, tapi dari awal pembuatan menu. Kita pastikan AKG, Angka Kecukupan Gizinya terpenuhi,"" katanya kepada wartawan, dikutip Sabtu, 27 September 2025.

Yudha mencontohkan, kini susu tidak lagi mengandung kadar gula tinggi. Sebab, Badan Gizi Nasional (BGN) sudah mengingatkan SPPG untuk tidak memberi susu berkadar gula tinggi.

“Itu salah satu bentuk pemilihan pembuatan menu. Baik itu tadi angka kecukupan gizinya, kemudian pemilihan apapun, komponen yang terdapat di dalam ompreng,” tuturnya.

Selain itu, menu disusun rutin setiap pekan melalui rapat tim gizi, agar variasi tetap terjaga. Hingga kini, SPPG Palmerah sudah mengembangkan lebih dari 40 jenis menu, termasuk menyesuaikan permintaan siswa agar mereka tidak bosan.

“Kita sering juga mendengarkan request-request dari siswa. Apakah dia, contoh yang terakhir itu, mereka pingin burger, kita coba fasilitasi. Hal-hal ini yang membuat anak-anak itu menjadi lebih nafsu makan, karena mereka juga merasa bahwa apa yang mereka inginkan itu bisa tersalurkan,“ ucap Yudha.

Asep Bidin Rosidin/PRMN

#MBG #news #SPPG #MakanBergizi","pikiran_rakyat","58880688","2025-10-02 13:01:31","1","0","0","0","1","222","in","1973735096881655992","[""#MBG"",""#news"",""#SPPG"",""#MakanBergizi""]","[]","2025-10-02 14:08:35"
"1960266000051372298","tl dr: 
-tray mbg dilabeli made in indonesia, tp sebenernya made in china
-ada batch yang pake stainless steel non foodgrade (pantes pada keracunan)
-ada label halal tapi pake lard","_waztra","395914689","2025-08-26 09:00:09","2","0","0","0","0","114","in","1960264794012844068","[]","[]","2025-09-16 21:45:03"
"1965383920670965872","@grok @WorldStrategist @Trinhnomics While we're talking about MBG, please add the cases of food poisoning all around Indonesia and the latest scandal on the non-food grade tray.","1212MAonTWT","3704082012","2025-09-09 11:56:56","8","1","0","0","0","968","en","1965351793472496050","[]","[""@grok"",""@WorldStrategist"",""@Trinhnomics""]","2025-09-16 18:34:03"
"1969287629872250902","Kalau gue inget-inget pelajaran kimia sewaktu SMA, wajar sih ada hipotesis bahwa food tray yang saat ini banyak digunakan jadi salah satu potensi penyebab keracunan. Kalau ga salah, sebagian tray punya grade stainless steel 201 yang sebenarnya ini tuh kurang tahan sama lingkungan lembab, garam, atau panas tinggi karena kandungan mangan tinggi (5,5–7,5%), nikel rendah (3,5–5,5%), & kromium cuma (16–18%).

Tray MBG sudah pasti tuh kan sering terpapar air, deterjen, & residu makanan, yang secara teknis bisa merusak lapisan oksida kromium. Ada reaksi elektrokimia yaitu Fe + O2 + H2O → Fe(OH)2, alias membentuk Fe2O3 (karat). Hasilnya, timbul proses kontaminasi dari leaching logam di tray ke makanan. Mungkin pemikiran ini salah, tapi—

1. Menu MBG kan kadang ada sayur, buah, atau sausnya, yang sebenarnya itu semua bisa aja bersifat asam. Makanan asam (pH < 4,5, kayak tomat, jeruk, atau cuka) bahkan mempercepat korosi tray 201 melalui reaksi H+ dengan lapisan oksida, bikin leaching ion mangan (Mn), nikel (Ni), & kromium (Cr). Sialnya, mangan berlebih bisa bikin gangguan neurologis (tremor, kekakuan otot), sementara kontaminasi nikel memicu alergi kulit atau masalah pernapasan jangka panjang. Jadi apakah set menu super minimalis yang selama ini membagongkan kita ternyata tujuannya adalah supaya anak-anak ga terkontaminasi berlebih? 😵‍💫

2. Makanan panas (misal nasi atau sup) mengeluarkan energi thermal yang memfasilitasi difusi ion dari matriks logam. Ini bisa mempercepat laju migrasi ion sampai 10 kali lipat. Bisa aja proses ini bikin kemunculan timbal (Pb) yang lebih dari 0,01 mg/kg di tray 201. Kalau kita cek kadar ini sudah melebihi batas aman yang ditetapkan sama BPOM.

3. Kira-kira apa yang biasa kita pakai buat nyuci piring? Yak betul. Spons & sabun cuci piring. Kalau pencucian tray 201 memakai spons abrasif atau deterjen kuat (misal mengandung asam sitrat) maka lapisan pasivasi (Cr2O3) bisa terkikis sehingga mempercepat korosi. Bayangkan kalau ada dapur yang mencuci secara massal tanpa prosedur standar. Goresan atau penyok pada tray bisa bikin area tersebut menjadi anoda dalam sel korosi yang mempercepat leaching.

By the way, karena penerima manfaat MBG adalah anak-anak, maka tingkat kerentanannya lebih besar dan reaksi yang timbul bisa lebih cepat, karena metabolisme anak lebih tinggi dibanding orang dewasa.

Lalu bagaimana dengan kasus keracunan yang disebabkan bakteri kayak Salmonella atau E. Coli? Ini mungkin banget dan bisa kita kategorikan sebagai kontaminasi sekunder dari tray rusak atau treatment bahan makanan yang ga sesuai standar higienis. Cuma untuk kemungkinan ini, variabelnya lebih banyak, termasuk variabel ga terduga kayak tingkat imunitas seseorang.

Jadi gmn dong supaya anak-anak ga keracunan MBG? Jawabannya sungguh sederhana wahai bapak ibu sekalian. Intinya dimulai dengan bangun lebih pagi lagi wkwk.","jisatorio","1414492515143622662","2025-09-20 06:28:53","0","0","0","0","0","20","in","1969287629872250902","[]","[]","2025-09-25 11:10:57"
