tweet_id,text_raw,author_username,author_id,created_at,like_count,reply_count,repost_count,quote_count,bookmark_count,impression_count,lang,query_group,query_label,tweet_url,text_clean,text_joined
1964517596495302753,"@infobdg Negara tidak hadir dikondisi seperti ini, sibuk joget &amp; pamerin MBG yang gak jelas impactnya!!! HARI INI, 2 anak Indonesia meninggal adalah BUKTI negara GAGAL memberi penghidupan, memberantas judol, MALAH MEMBERI PENGHARGAAN ke bedebah2 yang MEMBIARKAN itu terus terjadi!",satpamngantuk88,1898480055149621248,2025-09-07 02:34:28,6,0,2,0,0,1003,in,general,mbg_umum_short,https://x.com/satpamngantuk88/status/1964517596495302753,negara tidak hadir dikondisi seperti ini sibuk joget pamerin mbg yang gak jelas impactnya hari ini anak indonesia meninggal adalah bukti negara gagal memberi penghidupan memberantas judol malah memberi penghargaan ke bedebah yang membiarkan itu terus terjadi,negara tidak hadir kondisi seperti sibuk joget pamerin jelas impactnya hari anak indonesia tinggal adalah bukti negara gagal beri hidup berantas judol malah beri harga bedebah biar terus jadi
1964936179268375013,"Sudah makanan MBG tak layak datangnya pun terlambat
Sekian waktu tidak ada pembenahan, kritik dianggep angin lalu.
Sebenernya Presiden @prabowo tahu ngga ini program amburadul di lapangan?...
Vendor yg ditunjuk untuk MBG rerata kgak kompeten! https://t.co/wp8vDpvXaE",WagimanDeep212_,55200751,2025-09-08 06:17:46,888,111,367,24,28,24770,in,general,mbg_umum_short,https://x.com/WagimanDeep212_/status/1964936179268375013,sudah makanan mbg tak layak datangnya pun terlambat sekian waktu tidak ada pembenahan kritik dianggep angin lalu sebenernya presiden tahu ngga ini program amburadul di lapangan vendor yg ditunjuk untuk mbg rerata kgak kompeten,makan tak layak datang pun lambat sekian waktu tidak ada benah kritik dianggep angin lalu sebenernya presiden tahu ngga amburadul lapang vendor tunjuk rerata kgak kompeten
1964852704939065690,"@GoodRecom Sumpah?? Lebih ""enak"" kader yang bagiin mbg dong kalo gitu, karena kader disini yang membagikan mbg itu dapat upah per pcs mbg, 500 perak kalo gasalah, parah bgt sih masa guru diginiin 😭 woi",bbyraachun,1364521682,2025-09-08 00:46:04,0,0,0,0,0,220,in,general,mbg_umum_short,https://x.com/bbyraachun/status/1964852704939065690,sumpah lebih enak kader yang bagiin mbg dong kalo gitu karena kader disini yang membagikan mbg itu dapat upah per pcs mbg perak kalo gasalah parah bgt sih masa guru diginiin woi,sumpah lebih enak kader bagiin gitu kader sini bagi dapat upah per pcs perak gasalah parah bgt masa guru diginiin woi
1964994246701920265,"Terlepas dari complicity beliau dalan menaikkan pajak yang mencekik, her replacement would be a red flag for our country. Whether berpihak pada rakyat atau tidak, she is a professional yang terpaksa menaikkan pajak untuk menutup keboncosan keuangan negara (terimakasih mbg)",axelisontwt,1378278587019653123,2025-09-08 10:08:30,27,2,5,0,1,1599,in,general,mbg_umum_short,https://x.com/axelisontwt/status/1964994246701920265,terlepas dari complicity beliau dalan menaikkan pajak yang mencekik her replacement would be a red flag for our country whether berpihak pada rakyat atau tidak she is a professional yang terpaksa menaikkan pajak untuk menutup keboncosan keuangan negara terimakasih mbg,lepas complicity beliau dal naik pajak cekik her replacement would red flag our country whether pihak rakyat tidak she professional paksa naik pajak tutup keboncosan uang negara terimakasih
1965001939269398992,"@NenkMonica Betul sekali pernyataan ibu ini,knp mlh melempar tanggungjwb ke pihak sekolah atas keracunan siswa yg makan menu MBG?",GTS15ghonz,1584063265600319489,2025-09-08 10:39:04,2,0,1,0,0,78,in,general,mbg_umum_short,https://x.com/GTS15ghonz/status/1965001939269398992,betul sekali pernyataan ibu ini knp mlh melempar tanggungjwb ke pihak sekolah atas keracunan siswa yg makan menu mbg,betul sekali nyata ibu knp mlh lempar tanggungjwb pihak sekolah atas racun siswa menu
1965687752462369173,MBG is prabowo’s ego in a nutshell: superinflated &amp; unproductive. Udah ga ada lagi kah orang waras &amp; berintegritas di sekitar blio to tell him to stop program buang2 uang ini???,xkxcxvx,36717606,2025-09-10 08:04:15,160,6,36,0,11,6782,in,general,mbg_umum_short,https://x.com/xkxcxvx/status/1965687752462369173,mbg is prabowo s ego in a nutshell superinflated unproductive udah ga ada lagi kah orang waras berintegritas di sekitar blio to tell him to stop program buang uang ini,prabowo ego nutshell superinflated unproductive ada kah orang waras integritas sekitar blio tell him stop buang uang
1965747367858319394,"@Outstandjing Wow , 100rb ton setara 1 hari MBG",reychaldm,44900680,2025-09-10 12:01:08,0,0,0,0,0,53,in,general,mbg_umum_short,https://x.com/reychaldm/status/1965747367858319394,wow rb ton setara hari mbg,wow ton tara hari
1965652057337291229,"@mcdistressed Damn, menurut gw srimul ga salah gimana mau cari pemasukan buat nutupin program ndut
Dari awal 
- Prabowo udah berencana naikin pajak
- BUMN dari dulu ga pernah untung dan Menteri BUMN ga ada guna
- Program MBG cuma buang buang duit
- Kemenkeu ga bisa hapus duit pensiun karena UU",r_laplace,1226099210887393283,2025-09-10 05:42:25,11,0,1,0,1,1057,in,general,mbg_umum_short,https://x.com/r_laplace/status/1965652057337291229,damn menurut gw srimul ga salah gimana mau cari pemasukan buat nutupin program ndut dari awal prabowo udah berencana naikin pajak bumn dari dulu ga pernah untung dan menteri bumn ga ada guna program mbg cuma buang buang duit kemenkeu ga bisa hapus duit pensiun karena uu,damn turut srimul salah gimana mau cari pasu buat nutupin ndut awal prabowo rencana naikin pajak bumn dulu pernah untung menteri bumn ada guna cuma buang buang duit kemenkeu bisa hapus duit pensiun
1965348060550312147,"@txtdrimedia Sebenernya yang harus disalahin yang nyuruh mentrinya juga bjir, itu menkeu kan nyari-nyari duit biar nutupin boncosnya kas gara-gara MBG, IKN, kereta cepat, dan program lainnya yang bikin boncos 😂😂😂",yourfvrthello,1223834982,2025-09-09 09:34:26,1275,11,83,4,23,121312,in,general,mbg_umum_short,https://x.com/yourfvrthello/status/1965348060550312147,sebenernya yang harus disalahin yang nyuruh mentrinya juga bjir itu menkeu kan nyari nyari duit biar nutupin boncosnya kas gara gara mbg ikn kereta cepat dan program lainnya yang bikin boncos,sebenernya harus disalahin nyuruh tri bjir menkeu nyari nyari duit nutupin boncosnya kas gara gara ikn kereta cepat lain bikin boncos
1965462513455452627,@DokterTifa @prabowo Ada baiknya dana MBG itu diberikan kepada keluarga sang anak yg dapat jatah MBG biar ibunya sendiri atau keluarganya yg masakin makanan buat sianak karna ibunya lebih tau selera anaknya kan lebih praktis &amp; juga utk menghindari korup &amp; keracunan plus makanan yg ngak enak,ngehtv39488,1890047948442271744,2025-09-09 17:09:14,1,0,1,0,0,31,in,general,mbg_umum_short,https://x.com/ngehtv39488/status/1965462513455452627,ada baiknya dana mbg itu diberikan kepada keluarga sang anak yg dapat jatah mbg biar ibunya sendiri atau keluarganya yg masakin makanan buat sianak karna ibunya lebih tau selera anaknya kan lebih praktis juga utk menghindari korup keracunan plus makanan yg ngak enak,ada baik dana beri kepada keluarga sang anak dapat jatah ibu sendiri keluarga masakin makan buat sianak karna ibu lebih tau selera anak lebih praktis hindar korup racun plus makan ngak enak
1966253982147616963,"@DS_yantie Menunggu antrian, tersangka korupsi mbg.",Atmosph64511703,1161822738018734080,2025-09-11 21:34:15,0,0,0,0,0,43,in,general,mbg_umum_short,https://x.com/Atmosph64511703/status/1966253982147616963,menunggu antrian tersangka korupsi mbg,tunggu antri sangka korupsi
1966158863247487352,@Outstandjing Setara mbg sehari,all_siasia,1669025502890434561,2025-09-11 15:16:17,0,0,0,0,0,20,in,general,mbg_umum_short,https://x.com/all_siasia/status/1966158863247487352,setara mbg sehari,tara hari
1966372753654820883,"@christasyd bpjs itu bentuk sosialisme sih, ada juga MBG, KIP / KIS, KIMS, atau bahkan dulu ada BLT.

tapi iya sih, masih jauh bgt dr label negara sosialis",oscarguo,38154725,2025-09-12 05:26:12,4,0,0,0,0,255,in,general,mbg_umum_short,https://x.com/oscarguo/status/1966372753654820883,bpjs itu bentuk sosialisme sih ada juga mbg kip kis kims atau bahkan dulu ada blt tapi iya sih masih jauh bgt dr label negara sosialis,bpjs bentuk sosialisme ada kip kis kims bahkan dulu ada blt iya masih jauh bgt label negara sosialis
1966371010669871124,Lanjutkan MBG https://t.co/szwfPhqDS2,MemeComicIndo,744314137,2025-09-12 05:19:17,97,4,7,0,2,13411,in,general,mbg_umum_short,https://x.com/MemeComicIndo/status/1966371010669871124,lanjutkan mbg,lanjut
1966435707896930371,Dan pejabatnya bermewah2an. Klo ngomong ngasal n MBG byk yg keracunan,xyz07629305,1620224966116663297,2025-09-12 09:36:22,0,0,0,0,0,18,in,general,mbg_umum_short,https://x.com/xyz07629305/status/1966435707896930371,dan pejabatnya bermewah an klo ngomong ngasal n mbg byk yg keracunan,jabat mewah klo ngomong ngasal byk racun
1966476028580135030,@Gojekmilitan @prabowo Masih aja hambur2in uang buat MBG,YusifOufa,1886249498512654336,2025-09-12 12:16:35,1,0,0,0,0,84,in,general,mbg_umum_short,https://x.com/YusifOufa/status/1966476028580135030,masih aja hambur in uang buat mbg,masih hambur uang buat
1967879924439822420,"Minimal MBG makan beracun gajelas itu distop dulu atau di realokasi / fokus ke yg bener bener butuh

Uang dihambur hamburkan utk makanan kualitas buruk dan implementasi nya ga prudent",augenuous,1417472353013882888,2025-09-16 09:15:10,0,0,0,0,0,66,in,general,mbg_umum_short,https://x.com/augenuous/status/1967879924439822420,minimal mbg makan beracun gajelas itu distop dulu atau di realokasi fokus ke yg bener bener butuh uang dihambur hamburkan utk makanan kualitas buruk dan implementasi nya ga prudent,minimal racun gajelas stop dulu realokasi fokus bener bener butuh uang hambur hambur makan kualitas buruk implementasi prudent
1967820653618401414,Shout out untuk bapak kepsek di sekolahku yang berani menolak MBG karena MOU super nyeleneh ini 😁,inkamazinka,1480217991568449541,2025-09-16 05:19:38,2,0,0,0,0,115,in,general,mbg_umum_short,https://x.com/inkamazinka/status/1967820653618401414,shout out untuk bapak kepsek di sekolahku yang berani menolak mbg karena mou super nyeleneh ini,shout out bapak kepsek sekolah berani tolak mou super nyeleneh
1968518573455815085,"Jika merujuk petunjuk teknis, kejadian keracunan masal MBG mestinya sudah diumumkan sebagai KLB. Kejadian Luar Biasa.",zanatul_91,88120377,2025-09-18 03:32:55,1501,21,927,14,52,49850,in,general,mbg_umum_short,https://x.com/zanatul_91/status/1968518573455815085,jika merujuk petunjuk teknis kejadian keracunan masal mbg mestinya sudah diumumkan sebagai klb kejadian luar biasa,jika rujuk tunjuk teknis jadi racun masal mesti umum bagai klb jadi luar biasa
1970752832870719930,"@tempodotco Pak🙏🏻 mimpinya gausah tinggi-tinggi dulu🙏🏻 selesaikan masalah dalam negara🙏🏻 contohnya keracunan massal MBG🙏🏻 baru deh mikirin dunia🙏🏻😭 capek bgt jujur gue, org indo nya kocar-kacir, pemerintahnya sibuk jilat asing tapi kl demo blgnya ditunggangi antek asing ya Allah",johnnnoot,1575142909426696192,2025-09-24 07:31:04,0,0,0,0,0,359,in,general,mbg_umum_short,https://x.com/johnnnoot/status/1970752832870719930,pak mimpinya gausah tinggi tinggi dulu selesaikan masalah dalam negara contohnya keracunan massal mbg baru deh mikirin dunia capek bgt jujur gue org indo nya kocar kacir pemerintahnya sibuk jilat asing tapi kl demo blgnya ditunggangi antek asing ya allah,pak mimpi gausah tinggi tinggi dulu selesai masalah dalam negara contoh racun massal baru mikirin dunia capek bgt jujur gue org indo kocar kacir perintah sibuk jilat asing demo blgnya tunggang antek asing allah
1970758254793007286,"indonesia bakal jadi MBG dunia.
indonesia menjadi negara yang maju &amp; besar mungkin bisa dicapai karena sebagian negara kompetitor dalam bidang perdagangan akan berkurang karena keracunan massal.",heywannaknoww,1794238331699736576,2025-09-24 07:52:37,6,0,1,0,0,214,in,general,mbg_umum_short,https://x.com/heywannaknoww/status/1970758254793007286,indonesia bakal jadi mbg dunia indonesia menjadi negara yang maju besar mungkin bisa dicapai karena sebagian negara kompetitor dalam bidang perdagangan akan berkurang karena keracunan massal,indonesia bakal dunia indonesia jadi negara maju besar mungkin bisa capai bagi negara kompetitor dalam bidang dagang akan kurang racun massal
1971539340519157955,"Ribuan Siswa di Berbagai Daerah Keracunan MBG, Kapolri Bilang Begini https://t.co/gEX1VipKRa",eradotid,903229236051247104,2025-09-26 11:36:22,0,0,0,0,0,341,in,general,mbg_umum_short,https://x.com/eradotid/status/1971539340519157955,ribuan siswa di berbagai daerah keracunan mbg kapolri bilang begini,ribu siswa bagai daerah racun kapolri bilang begini
1971528502878072997,"@ARSIPAJA Pembagian peran:
Kepala BGN: persentase jumlah korban gak banyak jika dibandingkan yg menerima MBG.
Waka BGN: nangis
Buzzer: penyebabnya adlh sabotase

Tanggungjawab: 0%",el_placid,1604291236583460864,2025-09-26 10:53:18,2,0,0,0,0,2614,in,general,mbg_umum_short,https://x.com/el_placid/status/1971528502878072997,pembagian peran kepala bgn persentase jumlah korban gak banyak jika dibandingkan yg menerima mbg waka bgn nangis buzzer penyebabnya adlh sabotase tanggungjawab,bagi peran kepala bgn persentase jumlah korban banyak jika banding terima waka bgn nang buzzer sebab adlh sabotase tanggungjawab
1971444648129511900,"@barengwarga @tridentnare gengs tau ga, semalem orang gerindra diwawancara di kompas soal mbg, dia malah bilang : kedepannya PASTI bakal ada lagi keracunan tapi yang keracunan berapa persen? yang dapat pekerjaan dari mbg berapa juta orang? jangan diberhentikan lah programnya, kasian.

dia bilang pasti😔",mworagyyu,1770813248293466112,2025-09-26 05:20:06,0,1,0,0,0,230,in,general,mbg_umum_short,https://x.com/mworagyyu/status/1971444648129511900,gengs tau ga semalem orang gerindra diwawancara di kompas soal mbg dia malah bilang kedepannya pasti bakal ada lagi keracunan tapi yang keracunan berapa persen yang dapat pekerjaan dari mbg berapa juta orang jangan diberhentikan lah programnya kasian dia bilang pasti,gengs tau semalem orang gerindra wawancara kompas soal dia malah bilang depan pasti bakal ada racun racun berapa persen dapat kerja berapa juta orang jangan henti lah program kasi dia bilang pasti
1971949506779664535,"Banyak sekali PR-nya. MBG ini disalurkan bukan dari makanan yang fresh dari dapur melainkan sudah dipacking dan disalurkan beberapa saat kemudian. Banyak sekali faktor yang dapat memicu kontaminasi bakteri. Jika ingin berlanjut setidaknya hentikan sementara, evaluasi dan tinjau ulang, libatkan tenaga ahli dan profesional di bidangnya. Jika tidak bisa, hentikan saja programnya secara permanen",archvzze,1868178350071853056,2025-09-27 14:46:14,2,0,0,0,0,129,in,general,mbg_umum_short,https://x.com/archvzze/status/1971949506779664535,banyak sekali pr nya mbg ini disalurkan bukan dari makanan yang fresh dari dapur melainkan sudah dipacking dan disalurkan beberapa saat kemudian banyak sekali faktor yang dapat memicu kontaminasi bakteri jika ingin berlanjut setidaknya hentikan sementara evaluasi dan tinjau ulang libatkan tenaga ahli dan profesional di bidangnya jika tidak bisa hentikan saja programnya secara permanen,banyak sekali salur bukan makan fresh dapur lain dipacking salur beberapa saat kemudian banyak sekali faktor dapat picu kontaminasi bakteri jika ingin lanjut tidak henti sementara evaluasi tinjau ulang libat tenaga ahli profesional bidang jika tidak bisa henti program cara permanen
1971939207263461757,dia sendiri yg bikin mbg sebagai alat politik,susumilktea222,1876336423252754432,2025-09-27 14:05:18,2,1,1,0,0,263,in,general,mbg_umum_short,https://x.com/susumilktea222/status/1971939207263461757,dia sendiri yg bikin mbg sebagai alat politik,dia sendiri bikin bagai alat politik
1972440781106635201,memang mbg ini anggaran ngasih uang ke temen2 seragamnya,_waztra,395914689,2025-09-28 23:18:23,0,0,0,0,1,125,in,general,mbg_umum_short,https://x.com/_waztra/status/1972440781106635201,memang mbg ini anggaran ngasih uang ke temen seragamnya,memang anggar ngasih uang temen seragam
1972604338834112857,mbg dan ikn benar2 membuktikan nek sing gaonok duduk duwik e tapi political will e,_waztra,395914689,2025-09-29 10:08:18,0,1,1,0,0,139,in,general,mbg_umum_short,https://x.com/_waztra/status/1972604338834112857,mbg dan ikn benar membuktikan nek sing gaonok duduk duwik e tapi political will e,ikn benar bukti nek sing gaonok duduk duwik political will
1972618327748182382,"@DMarginale Mknya saya malas membahas ttg keracunan MBG krn mslhnya apa, solusinya apa jg...🤣🤣🤣🤣🤣🤣",BeBuzzerNKRI,998800626816499712,2025-09-29 11:03:53,0,1,0,0,0,22,in,general,mbg_umum_short,https://x.com/BeBuzzerNKRI/status/1972618327748182382,mknya saya malas membahas ttg keracunan mbg krn mslhnya apa solusinya apa jg,mknya saya malas bahas ttg racun mslhnya apa solusi apa
1973723695383228586,"@papanberjalan Gini pak, BPOM tu kan obat dan makanan. MBG itu bukan makanan, itu  proyek pemerenta 🙊🙉🙈",ridwanadit,115603547,2025-10-02 12:16:13,39,2,1,0,0,2115,in,general,mbg_umum_short,https://x.com/ridwanadit/status/1973723695383228586,gini pak bpom tu kan obat dan makanan mbg itu bukan makanan itu proyek pemerenta,gin pak bpom obat makan bukan makan proyek renta
1973635580417417537,HAK ASASI MANUSIA SISWA-SISWA KITA BERANGKAT KE SEKOLAH ITU UNTUK BELAJAR TOLOL BUKAN DILARIKAN KE RUMAH SAKIT APALAGI SAMPAI HARUS MENINGGAL KARENA KERACUNAN MBG MAKAN BERACUN GRATIS TOLOL @NataliusPigai2,jijirnyinyir,1047680225138466816,2025-10-02 06:26:05,7,3,1,0,0,424,in,general,mbg_umum_short,https://x.com/jijirnyinyir/status/1973635580417417537,hak asasi manusia siswa siswa kita berangkat ke sekolah itu untuk belajar tolol bukan dilarikan ke rumah sakit apalagi sampai harus meninggal karena keracunan mbg makan beracun gratis tolol,hak asasi manusia siswa siswa kita berangkat sekolah ajar tolol bukan lari rumah sakit apalagi sampai harus tinggal racun racun tolol
1973883152184848743,@tempodotco Sumpel aja ap lobang idungnya pke nampan mbg @seaalynzz,beigezle,1347089149870788610,2025-10-02 22:49:51,0,1,0,0,0,198,in,general,mbg_umum_short,https://x.com/beigezle/status/1973883152184848743,sumpel aja ap lobang idungnya pke nampan mbg,sumpel lobang idungnya pke nampan
1973761382811365687,"Kalau saya jadi Pak Mahfud, saya akan ajukan Citizen Law suit pada penyelenggara MBG. 
Kalau.....",naleraja,1727673345725091840,2025-10-02 14:45:59,0,0,0,0,0,61,in,general,mbg_umum_short,https://x.com/naleraja/status/1973761382811365687,kalau saya jadi pak mahfud saya akan ajukan citizen law suit pada penyelenggara mbg kalau,saya pak mahfud saya akan aju citizen law suit selenggara
1974151564295352564,"@kegblgnunfaedh Banyak banget nih pengalihan isunya wkwk. Fokus ke MBG guys, banyak korban.",dokduk07,1196656524,2025-10-03 16:36:25,3,0,0,0,0,634,in,general,mbg_umum_short,https://x.com/dokduk07/status/1974151564295352564,banyak banget nih pengalihan isunya wkwk fokus ke mbg guys banyak korban,banyak banget alih isu wkwk fokus guys banyak korban
1975140475238850957,My MBG today: Nasi (jelas) + Iwak bandeng goreng + Kuah + Tempe mendoan (maybe) + sayuran (tomat + kentang) + Jeruk. Iwak bandeng goreng e wenak tenan :),geludyuk_,1473119284180107265,2025-10-06 10:06:00,0,0,0,0,0,14,in,general,mbg_umum_short,https://x.com/geludyuk_/status/1975140475238850957,my mbg today nasi jelas iwak bandeng goreng kuah tempe mendoan maybe sayuran tomat kentang jeruk iwak bandeng goreng e wenak tenan,today nasi jelas iwak bandeng goreng kuah tempe mendoan maybe sayur tomat kentang jeruk iwak bandeng goreng wenak tenan
1976320549539414278,"@bhres_ wkwk betul, btw ((lembaga)) itu pernah buat pitchdeck terkait MBG, dan bisa ketebak isiannya sehalu apa.",_n0t4lfiaccount,248202568,2025-10-09 16:15:11,3,1,0,0,0,440,in,general,mbg_umum_short,https://x.com/_n0t4lfiaccount/status/1976320549539414278,wkwk betul btw lembaga itu pernah buat pitchdeck terkait mbg dan bisa ketebak isiannya sehalu apa,wkwk betul btw lembaga pernah buat pitchdeck kait bisa tebak isi sehalu apa
1952403313900900395,"@Carbaroxabane @und_cuckoosnest @FelixSGL1 Ya gpp, hak presiden utk menyusun APBN

Masalah lu dg MBG apa?",muttle9,2468828202,2025-08-04 16:16:38,0,1,0,0,0,17,in,general,mbg_umum_short,https://x.com/muttle9/status/1952403313900900395,ya gpp hak presiden utk menyusun apbn masalah lu dg mbg apa,gpp hak presiden susun apbn masalah apa
1954856474561204449,"@ruliemaulana Kalo buat MBG misalkan substitusi MBG yaitu ngasih duit ke ortu belanjakan wajib sesuai menu harian n ada pertanggungjawaban ke sekolah melalui evidence apalah itu, n kalo ada penyelewengan kena sanksi. Ini masih cocok, belanja makanan kan. Kalo elektronik susah sih kata ane",FelixSGL1,2862109627,2025-08-11 10:44:37,4,1,0,0,0,210,in,general,mbg_umum_short,https://x.com/FelixSGL1/status/1954856474561204449,kalo buat mbg misalkan substitusi mbg yaitu ngasih duit ke ortu belanjakan wajib sesuai menu harian n ada pertanggungjawaban ke sekolah melalui evidence apalah itu n kalo ada penyelewengan kena sanksi ini masih cocok belanja makanan kan kalo elektronik susah sih kata ane,buat misal substitusi yaitu ngasih duit ortu belanja wajib sesuai menu hari ada pertanggungjawaban sekolah lalu evidence apa ada seleweng kena sanksi masih cocok belanja makan elektronik susah kata ane
1955579656549388314,"@ardisatriawan Mbg si paling bisa meningkatkan kemampuan bahasa inggris dan matematika, coba sini gw tes perkalian tuh bocah2",iniifafa,1064867925960454144,2025-08-13 10:38:17,0,1,0,0,0,601,in,general,mbg_umum_short,https://x.com/iniifafa/status/1955579656549388314,mbg si paling bisa meningkatkan kemampuan bahasa inggris dan matematika coba sini gw tes perkalian tuh bocah,paling bisa tingkat mampu bahasa inggris matematika coba sini tes kali tuh bocah
1955567614639624331,"@ardisatriawan Batal kan program MBG..
Naikan gaji dosen dan guru lagi bermanfaat...",EsterSusiani2,1331863868457447430,2025-08-13 09:50:26,2,0,0,0,0,311,in,general,mbg_umum_short,https://x.com/EsterSusiani2/status/1955567614639624331,batal kan program mbg naikan gaji dosen dan guru lagi bermanfaat,batal naik gaji dosen guru manfaat
1956219615392227757,"Prabowo Klaim MBG Jalan 8 Bulan, Prestasi Anak di Sekolah Meningkat https://t.co/FD91GRbjT4",CNNIndonesia,17128975,2025-08-15 05:01:15,114,189,26,61,18,36683,in,general,mbg_umum_short,https://x.com/CNNIndonesia/status/1956219615392227757,prabowo klaim mbg jalan bulan prestasi anak di sekolah meningkat,prabowo klaim jalan bulan prestasi anak sekolah tingkat
1956350903390511457,"Menurut data dari berbagai sumber seperti BPOM, Wikipedia, dan laporan berita (Tempo, BBC, Kompas, Detik) hingga 15 Agustus 2025, terdapat sekitar 20 kasus keracunan massal terkait program MBG sejak diluncurkan 6 Januari 2025, dengan total korban lebih dari 2.000 orang. Kasus terbaru di Sragen (365 korban) dan Sleman (212 korban) pada 12-13 Agustus. Angka ini bisa bertambah karena pelaporan berkelanjutan.",grok,1720665183188922368,2025-08-15 13:42:57,0,1,0,0,0,168,in,general,mbg_umum_short,https://x.com/grok/status/1956350903390511457,menurut data dari berbagai sumber seperti bpom wikipedia dan laporan berita tempo bbc kompas detik hingga agustus terdapat sekitar kasus keracunan massal terkait program mbg sejak diluncurkan januari dengan total korban lebih dari orang kasus terbaru di sragen korban dan sleman korban pada agustus angka ini bisa bertambah karena pelaporan berkelanjutan,turut data bagai sumber seperti bpom wikipedia lapor berita tempo bbc kompas detik hingga agustus dapat sekitar kasus racun massal kait sejak luncur januari total korban lebih orang kasus baru sragen korban sleman korban agustus angka bisa tambah lapor lanjut
1957024695737328126,"Mengapa Hampir Separuh Anggaran Pendidikan untuk Program MBG dan Bagaimana Dampaknya? #Kesehatan #AdadiKompas

https://t.co/nX7t8asXTI",KompasKlasika,155456716,2025-08-17 10:20:21,0,0,0,0,0,33,in,general,mbg_umum_short,https://x.com/KompasKlasika/status/1957024695737328126,mengapa hampir separuh anggaran pendidikan untuk program mbg dan bagaimana dampaknya kesehatan adadikompas,mengapa hampir paruh anggar didik bagaimana dampak sehat adadikompas
1962314123590652258,"and his mbg agenda yang anggarannya triliunan itu could neverrrrr. malah cuma bikin keracunan massal doang, smh.",dl_know_no,1782378500198113280,2025-09-01 00:38:39,0,0,0,0,1,74,in,general,mbg_umum_short,https://x.com/dl_know_no/status/1962314123590652258,and his mbg agenda yang anggarannya triliunan itu could neverrrrr malah cuma bikin keracunan massal doang smh,and his agenda anggar triliun could neverrrrr malah cuma bikin racun massal doang smh
1962868180659126688,@CNNIndonesia buat rakyat jelata dikasihnya MBG. buat rakyat yang ini dikasihnya makan apa ya? pasti yang enak donggg masa kayak menu MBG kan ga mungkin🤭 uuuu spesial sekali kelihatannya WKWKWKW,ailafiles,284235433,2025-09-02 13:20:17,0,0,0,0,0,470,in,general,mbg_umum_short,https://x.com/ailafiles/status/1962868180659126688,buat rakyat jelata dikasihnya mbg buat rakyat yang ini dikasihnya makan apa ya pasti yang enak donggg masa kayak menu mbg kan ga mungkin uuuu spesial sekali kelihatannya wkwkwkw,buat rakyat jelata kasih buat rakyat kasih apa pasti enak donggg masa menu mungkin uuuu spesial sekali lihat wkwkwkw
