tweet_id,text_raw,author_username,author_id,created_at,like_count,reply_count,repost_count,quote_count,bookmark_count,impression_count,lang,query_group,query_label,tweet_url,text_clean,text_joined
1959169840717140106,@kompascom Bukan setiap Pos MBG ada ahli gizi yaa ?,thisis_emlayy,1875227627533062145,2025-08-23 08:24:24,0,0,0,0,0,40,in,general,mbg_umum_short,https://x.com/thisis_emlayy/status/1959169840717140106,bukan setiap pos mbg ada ahli gizi yaa,bukan tiap pos ada ahli gizi yaa
1959899780240613502,Inilah ketika QC ama SOPnya dr MBG sptnya ada yg tidak berjalan.,yusufgunawan,78619866,2025-08-25 08:44:55,11,5,0,0,0,1009,in,general,mbg_umum_short,https://x.com/yusufgunawan/status/1959899780240613502,inilah ketika qc ama sopnya dr mbg sptnya ada yg tidak berjalan,ini ketika ama sop sptnya ada tidak jalan
1959988706728927649,"@ardisatriawan Jumat sore kemaren tiba² dapat surat di grup kelas anak sulung kalo sekolah nya kebagian MBG. Dengan kesadaran penuh langsung wa wakel nya, ""Maaf Miss, ijin konfirmasi kalau anak saya tidak ikut MBG &amp; tidak juga membawa pulang MBG tersebut bila tidak dimakan di sekolah."" 🙏🏻🙏🏻🙏🏻",cowcoffee,92256385,2025-08-25 14:38:17,0,0,0,0,0,14,in,general,mbg_umum_short,https://x.com/cowcoffee/status/1959988706728927649,jumat sore kemaren tiba dapat surat di grup kelas anak sulung kalo sekolah nya kebagian mbg dengan kesadaran penuh langsung wa wakel nya maaf miss ijin konfirmasi kalau anak saya tidak ikut mbg tidak juga membawa pulang mbg tersebut bila tidak dimakan di sekolah,jumat sore kemaren tiba dapat surat grup kelas anak sulung sekolah bagi sadar penuh langsung wakel maaf miss ijin konfirmasi anak saya tidak ikut tidak bawa pulang sebut bila tidak makan sekolah
1959949656630428099,@bermuaradilaut mengalihkan isu dari ridwan kamil dan lisa yang merupakan pengalihan isu dari keracunan mbg yang merupakan pengalihan isu dari naiknya tunjangan dpr yang merupakan pengalihan isu dari prabowo tantrum yang merupakan pengalihan isu dari ijazah jokowi yang merupakan pengalihan isu-,_waztra,395914689,2025-08-25 12:03:06,0,0,0,0,0,105,in,general,mbg_umum_short,https://x.com/_waztra/status/1959949656630428099,mengalihkan isu dari ridwan kamil dan lisa yang merupakan pengalihan isu dari keracunan mbg yang merupakan pengalihan isu dari naiknya tunjangan dpr yang merupakan pengalihan isu dari prabowo tantrum yang merupakan pengalihan isu dari ijazah jokowi yang merupakan pengalihan isu,alih isu ridwan kamil lisa rupa alih isu racun rupa alih isu naik tunjang dpr rupa alih isu prabowo tantrum rupa alih isu ijazah jokowi rupa alih isu
1960062969875939636,gimana kalo pejabat yang cicipin dulu makan mbg 1 bulan aja,gyeomhunter,1294883892,2025-08-25 19:33:22,1,3,0,0,0,92,in,general,mbg_umum_short,https://x.com/gyeomhunter/status/1960062969875939636,gimana kalo pejabat yang cicipin dulu makan mbg bulan aja,gimana jabat cicipin dulu bulan
1959880274365579511,gua tungguin berita pejabat keracunan mbg,tifosiiy,1932480493620244482,2025-08-25 07:27:24,2,0,0,0,0,148,in,general,mbg_umum_short,https://x.com/tifosiiy/status/1959880274365579511,gua tungguin berita pejabat keracunan mbg,gua tungguin berita jabat racun
1960700572316901524,Terus ini gimanaaaa 😭 mana udah sepekan ini di sekolah anakku dapt mbg 😭,expelliarmuch,2266461780,2025-08-27 13:46:59,0,0,0,0,0,37,in,general,mbg_umum_short,https://x.com/expelliarmuch/status/1960700572316901524,terus ini gimanaaaa mana udah sepekan ini di sekolah anakku dapt mbg,terus gimanaaaa mana pek sekolah anak dapt
1960570813360267582,"[Breaking News] Keracunan massal  MBG kembali terjadi di Berbah, Sleman, Yogyakarta 
puluhan siswa SMP di Pulangkan karena muntah dan diare. https://t.co/UcaHAmJMaq",merapi_uncover,1279804428724211712,2025-08-27 05:11:22,1564,184,442,162,59,114755,in,general,mbg_umum_short,https://x.com/merapi_uncover/status/1960570813360267582,breaking news keracunan massal mbg kembali terjadi di berbah sleman yogyakarta puluhan siswa smp di pulangkan karena muntah dan diare,breaking news racun massal kembali jadi bah sleman yogyakarta puluh siswa smp pulang muntah diare
1960670650793910450,@tanyakanrl orang tua yg setuju mbg emg perlu dikasi pelajaran,xellxo80,1323493956714258433,2025-08-27 11:48:05,0,0,0,0,0,119,in,general,mbg_umum_short,https://x.com/xellxo80/status/1960670650793910450,orang tua yg setuju mbg emg perlu dikasi pelajaran,orang tua tuju emg perlu kasi ajar
1960686848818470928,@tanyakanrl Boleh nggak sih kalau anak kita gak usah ikut mbg,BuAgus17,1451214331446579206,2025-08-27 12:52:27,0,0,0,0,0,78,in,general,mbg_umum_short,https://x.com/BuAgus17/status/1960686848818470928,boleh nggak sih kalau anak kita gak usah ikut mbg,boleh anak kita usah ikut
1960700408818753957,@MariaAlkaff_ @NasDem @ahmadsahroni88 @DPR_RI Mbaknya Cerdas pasti efek Program MBG,lanceng_sonok,1880710589762449408,2025-08-27 13:46:20,2,3,0,0,0,1071,in,general,mbg_umum_short,https://x.com/lanceng_sonok/status/1960700408818753957,mbaknya cerdas pasti efek program mbg,mbak cerdas pasti efek
1960914436291739843,"@MurtadhaOne1 Anak2 SMA ini tahun 2029 udh bisa menggunakan hak suaranya.
Semakin program MBG ngotot dilanjutin  pemerintah, tiap hari anak2 ini akan terus melihat kegagalan pemerintah PrabowoGibran",thezaym,372805555,2025-08-28 03:56:48,88,0,4,0,0,6040,in,general,mbg_umum_short,https://x.com/thezaym/status/1960914436291739843,anak sma ini tahun udh bisa menggunakan hak suaranya semakin program mbg ngotot dilanjutin pemerintah tiap hari anak ini akan terus melihat kegagalan pemerintah prabowogibran,anak sma tahun udh bisa guna hak suara makin ngotot dilanjutin perintah tiap hari anak akan terus lihat gagal perintah prabowogibran
1961123229848015040,@MurtadhaOne1 abis ini dipanggil guru BK gegara mainin MBG 🙃,kangparkiir,590771660,2025-08-28 17:46:28,0,0,0,0,0,15,in,general,mbg_umum_short,https://x.com/kangparkiir/status/1961123229848015040,abis ini dipanggil guru bk gegara mainin mbg,abis panggil guru gegara mainin
1960876411625070665,@MurtadhaOne1 Indikasi #korupsi kental banget 🤔#MBG 🇮🇩,AnggodoJosh,967969138676125696,2025-08-28 01:25:42,2,0,1,0,1,124,in,general,mbg_umum_short,https://x.com/AnggodoJosh/status/1960876411625070665,indikasi korupsi kental banget mbg,indikasi korupsi kental banget
1961049264878211123,"@tanyakanrl ternyata sekolahku dilewatin program mbg karna ini, makasih banyak YAALLAH, tapi pemerintah tolol pake banget sih.",flarvze,1446007662018117634,2025-08-28 12:52:33,0,0,0,0,0,36,in,general,mbg_umum_short,https://x.com/flarvze/status/1961049264878211123,ternyata sekolahku dilewatin program mbg karna ini makasih banyak yaallah tapi pemerintah tolol pake banget sih,nyata sekolah dilewatin karna makasih banyak yaallah perintah tolol pake banget
1960985132405547341,"Pak @prabowo yth
Mas menteri @setkabgoid yth

Program MBG ini sangat luar biasa dan jadi solusi cepat meningkatkan kecerdasan anak bangsa dgn cara memperbaiki asupan gizi nya

Namun praktek di lapangan menemukan banyak ""kekonyolan"" yg berpotensi menciderai program yg sangat baik ini

Usulan perbaikan :
1. Kita bisa meniru program makan siang anak sekolah di Jepang dan Finlandia dimana KOMITE ORANG TUA siswa diikut sertakan dalam pengelolaan nya

2. Penanggung jawab program, Penganggaran dan Pembiayaan tetap dilakukan oleh Badan Gizi Nasional (BGN)

3. Komite Orang Tua Siswa bersama ahli gizi MERANCANG MENU untuk satu periode dst dst

4. Perwakilan dari Komite Orang Tua secara rutin mengawasi proses memasak dan menyajikan makanan di kelas

Melibatkan organisasi orang tua siswa akan efektif MEMPERBAIKI (citra) program ini karena setiap orang tua siswa akan berusaha anak-anaknya mendapatkan menu terbaik sesuai anggaran yg tersedia",nalar_logis,1557182798888198144,2025-08-28 08:37:43,1,0,0,0,1,40,in,general,mbg_umum_short,https://x.com/nalar_logis/status/1960985132405547341,pak yth mas menteri yth program mbg ini sangat luar biasa dan jadi solusi cepat meningkatkan kecerdasan anak bangsa dgn cara memperbaiki asupan gizi nya namun praktek di lapangan menemukan banyak kekonyolan yg berpotensi menciderai program yg sangat baik ini usulan perbaikan kita bisa meniru program makan siang anak sekolah di jepang dan finlandia dimana komite orang tua siswa diikut sertakan dalam pengelolaan nya penanggung jawab program penganggaran dan pembiayaan tetap dilakukan oleh badan gizi nasional bgn komite orang tua siswa bersama ahli gizi merancang menu untuk satu periode dst dst perwakilan dari komite orang tua secara rutin mengawasi proses memasak dan menyajikan makanan di kelas melibatkan organisasi orang tua siswa akan efektif memperbaiki citra program ini karena setiap orang tua siswa akan berusaha anak anaknya mendapatkan menu terbaik sesuai anggaran yg tersedia,pak yth mas menteri yth sangat luar biasa solusi cepat tingkat cerdas anak bangsa dgn cara baik asupan gizi namun praktek lapang temu banyak konyol potensi menciderai sangat baik usul baik kita bisa tiru siang anak sekolah jepang finlandia mana komite orang tua siswa ikut serta dalam kelola tanggung jawab anggar biaya tetap laku oleh badan gizi nasional bgn komite orang tua siswa sama ahli gizi rancang menu satu periode dst dst wakil komite orang tua cara rutin awas proses masak saji makan kelas libat organisasi orang tua siswa akan efektif baik citra tiap orang tua siswa akan usaha anak anak dapat menu baik sesuai anggar sedia
1961407561179029981,"@Beritasatu MBG terus urusin....MBG teruss........
Keras kepala &amp; ego Wowo yg gak mau terima masukan ttg MBG lah salah satu penyebab sulitnya ekonomi saat ini https://t.co/CRotFMtrK1",DonnyRus,191769879,2025-08-29 12:36:18,2,0,0,0,0,159,in,general,mbg_umum_short,https://x.com/DonnyRus/status/1961407561179029981,mbg terus urusin mbg teruss keras kepala ego wowo yg gak mau terima masukan ttg mbg lah salah satu penyebab sulitnya ekonomi saat ini,terus urusin teruss keras kepala ego wowo mau terima masuk ttg lah salah satu sebab sulit ekonomi saat
1961355629727019327,"WHAT DID U DO BESIDE NGABIS NGABISIN ANGGARAN BUAT MBG, KOPERASI, DAN DANANTARA YANG SEMUANYA OTW ANCUR ITU??
PERCAYA BAHWA BENTAR LAGI SEMUA ANCUR MAH IYA",chillinsoda,1061785244934651906,2025-08-29 09:09:57,2,0,0,0,0,36,in,general,mbg_umum_short,https://x.com/chillinsoda/status/1961355629727019327,what did u do beside ngabis ngabisin anggaran buat mbg koperasi dan danantara yang semuanya otw ancur itu percaya bahwa bentar lagi semua ancur mah iya,what did beside ngabis ngabisin anggar buat koperasi danantara semua otw ancur percaya bahwa bentar semua ancur iya
1961261226794832070,"313 hari isinya rakyat kena phk, pelajar keracunan mbg, tunjangan gaji pejabat naik ga ngotak, ex koruptor dikasih penghargaan, polisi ngebunuh rakyat, korupsi sampe ke katering haji. jadi sebelah mana “demi rakyat”-nya?",ursafestplaces,1424374085035859972,2025-08-29 02:54:49,24,0,6,0,0,1180,in,general,mbg_umum_short,https://x.com/ursafestplaces/status/1961261226794832070,hari isinya rakyat kena phk pelajar keracunan mbg tunjangan gaji pejabat naik ga ngotak ex koruptor dikasih penghargaan polisi ngebunuh rakyat korupsi sampe ke katering haji jadi sebelah mana demi rakyat nya,hari isi rakyat kena phk ajar racun tunjang gaji jabat naik ngotak koruptor kasih harga polisi ngebunuh rakyat korupsi sampe katering haji belah mana demi rakyat
1961316932927307950,@tanyakanrl ihh di sekolah aku bulan depan ada mbg...,butterfwlhy,1439825007069126656,2025-08-29 06:36:10,0,0,0,0,0,5,in,general,mbg_umum_short,https://x.com/butterfwlhy/status/1961316932927307950,ihh di sekolah aku bulan depan ada mbg,ihh sekolah aku bulan depan ada
1961364194340618287,"@kompascom Jadi menhan jaman jkw aja habisin duit. Jadi presiden mbg, bintang jasa, kabinet gendut. Haji jadi kementrian.",BruhGusGus,1767483638319656960,2025-08-29 09:43:58,3,0,0,0,0,38,in,general,mbg_umum_short,https://x.com/BruhGusGus/status/1961364194340618287,jadi menhan jaman jkw aja habisin duit jadi presiden mbg bintang jasa kabinet gendut haji jadi kementrian,menhan jaman jkw habisin duit presiden bintang jasa kabinet gendut haji tri
1961450328651387082,"@BudiBukanIntel Batalin program mbg juga lah om bud, program ga guna cuman jadi bahan bancakan korupsi. Akar semua efisiensi anggaran kan gara2 program ini",satekacangcut,1768005836423483392,2025-08-29 15:26:14,85,0,6,0,1,4846,in,general,mbg_umum_short,https://x.com/satekacangcut/status/1961450328651387082,batalin program mbg juga lah om bud program ga guna cuman jadi bahan bancakan korupsi akar semua efisiensi anggaran kan gara program ini,batalin lah bud guna cuman bahan bancak korupsi akar semua efisiensi anggar gara
1961938059228065806,"@M45Broo_ Kasus keracunan karena MBG, ga ikut, bang?
Kata mutiara ""ndasmu"" ga termasuk, bang?",stenlyssimo,17773749,2025-08-30 23:44:19,0,0,0,0,0,112,in,general,mbg_umum_short,https://x.com/stenlyssimo/status/1961938059228065806,kasus keracunan karena mbg ga ikut bang kata mutiara ndasmu ga termasuk bang,kasus racun ikut bang kata mutiara ndasmu masuk bang
1961869497125748744,@ttorroo Adek gw yg sd tiap dpt mbg ga di makan katanya rasanya kek racun😭😭😭,drkxlty,1142415869655392256,2025-08-30 19:11:52,0,0,0,0,0,44,in,general,mbg_umum_short,https://x.com/drkxlty/status/1961869497125748744,adek gw yg sd tiap dpt mbg ga di makan katanya rasanya kek racun,adek tiap dpt kata rasa kek racun
1962164508077822226,@somexthread Evaluasi mbg klo yg dibawah pd curang mending gausah lanjut,brdlfy,117771196,2025-08-31 14:44:08,0,0,0,0,0,58,in,general,mbg_umum_short,https://x.com/brdlfy/status/1962164508077822226,evaluasi mbg klo yg dibawah pd curang mending gausah lanjut,evaluasi klo bawah curang mending gausah lanjut
1961978887967297939,@Official_Ansor sampeyan sdh liat MBG yg dibuang ke tmptt sampah?  makanan tidak layak dikasihkan ke anak2 generasi mendatang ... membuang makanan adalah hal yg mubadzir yg mendekatkan pd laknat Tuhan tp jk yg dikasihkan mmng tdk layak berarti yg menyediakan di awal mmg menginginkan laknat Tuhan,RizkaIrawan4,1683486451,2025-08-31 02:26:33,20,0,2,0,0,1696,in,general,mbg_umum_short,https://x.com/RizkaIrawan4/status/1961978887967297939,sampeyan sdh liat mbg yg dibuang ke tmptt sampah makanan tidak layak dikasihkan ke anak generasi mendatang membuang makanan adalah hal yg mubadzir yg mendekatkan pd laknat tuhan tp jk yg dikasihkan mmng tdk layak berarti yg menyediakan di awal mmg menginginkan laknat tuhan,sampeyan sdh liat buang tmptt sampah makan tidak layak kasih anak generasi datang buang makan adalah hal mubadzir dekat laknat tuhan kasih mmng tdk layak arti sedia awal mmg ingin laknat tuhan
1962302964015796251,@somexthread Hapus MBG segera,Esth_Esthi,2453251970,2025-08-31 23:54:19,0,0,0,0,0,10,in,general,mbg_umum_short,https://x.com/Esth_Esthi/status/1962302964015796251,hapus mbg segera,hapus segera
1962174623937970682,@NOTASLIMBOY @prabowo MBG stop juga. Rakyat ngesot krn pajak gila2an kan larinya buat bela2in MBG,Miamilumi,1402047676871446528,2025-08-31 15:24:20,0,0,0,0,0,786,in,general,mbg_umum_short,https://x.com/Miamilumi/status/1962174623937970682,mbg stop juga rakyat ngesot krn pajak gila an kan larinya buat bela in mbg,stop rakyat ngesot pajak gila lari buat bela
1962193678619066374,"@somexthread - Tes Polisi/TNI minimal D3
- Kembalikan Sistem Sertifikat Tanah ke blangko kertas, jgn hny berbentuk digital
- Hentikan program MBG
- Hapus jabatan wakil menteri
- Hentikan rangkap jabatan
- Kembalikan bulog untuk ketahanan pangan
- Hentikan program sekolah rakyat",alejandro10_01,1755578064871030784,2025-08-31 16:40:03,83,0,13,0,2,6568,in,general,mbg_umum_short,https://x.com/alejandro10_01/status/1962193678619066374,tes polisi tni minimal d kembalikan sistem sertifikat tanah ke blangko kertas jgn hny berbentuk digital hentikan program mbg hapus jabatan wakil menteri hentikan rangkap jabatan kembalikan bulog untuk ketahanan pangan hentikan program sekolah rakyat,tes polisi tni minimal kembali sistem sertifikat tanah blangko kertas jgn hny bentuk digital henti hapus jabat wakil menteri henti rangkap jabat kembali bulog tahan pangan henti sekolah rakyat
1962553488107581858,program MBG inisiatif temen temen asia tenggara lebih efektif dari versi pemerintah,esya7,48206234,2025-09-01 16:29:48,0,0,0,0,0,80,in,general,mbg_umum_short,https://x.com/esya7/status/1962553488107581858,program mbg inisiatif temen temen asia tenggara lebih efektif dari versi pemerintah,inisiatif temen temen asia tenggara lebih efektif versi perintah
1962722431484993556,@icykids jir itu bisa bikin mbg beneran bergizi,nxxdslenia,542230672,2025-09-02 03:41:07,0,0,0,0,0,52,in,general,mbg_umum_short,https://x.com/nxxdslenia/status/1962722431484993556,jir itu bisa bikin mbg beneran bergizi,jir bisa bikin beneran
1962833218966880468,"Dut duttt. Sekarang diakui dunia sebagai penjahat HAM. 
Teruslah berbangga di dalam kepalamu sendiri bahwa MBG adalah program yang diakui dunia. 🥰

Early birthday gift untuk si gemoy 🎉",ismailrumpa,602458231,2025-09-02 11:01:21,0,0,0,0,0,48,in,general,mbg_umum_short,https://x.com/ismailrumpa/status/1962833218966880468,dut duttt sekarang diakui dunia sebagai penjahat ham teruslah berbangga di dalam kepalamu sendiri bahwa mbg adalah program yang diakui dunia early birthday gift untuk si gemoy,dut duttt sekarang aku dunia bagai jahat ham terus bangga dalam kepala sendiri bahwa adalah aku dunia early birthday gift gemoy
1962881719167775070,"@BosPurwa Orang ini ngomongin anak keracunan mbg aja cuma sebatas statistik angka,
Empatinya udah ga ada si gendut ini https://t.co/m8fMUeqsR1",jellygamalama,793011606108053504,2025-09-02 14:14:05,0,0,0,0,0,6,in,general,mbg_umum_short,https://x.com/jellygamalama/status/1962881719167775070,orang ini ngomongin anak keracunan mbg aja cuma sebatas statistik angka empatinya udah ga ada si gendut ini,orang ngomongin anak racun cuma batas statistik angka empati ada gendut
1963080517500498404,"@txtdrimedia Bicara perikemanusiaan yang adil dan beradab, tapi ga pernah punya sensitivitas pada kondisi rakyat saat menjabat.

Kasus bayi bernama Raya yang meninggal karena cacingan, kasus ribuan anak yang keracunan MBG, dan masalah gaji guru yang selalu jadi angin lalu. Kamu diam bu.",titisharyo,200530249,2025-09-03 03:24:02,60,1,15,0,2,28631,in,general,mbg_umum_short,https://x.com/titisharyo/status/1963080517500498404,bicara perikemanusiaan yang adil dan beradab tapi ga pernah punya sensitivitas pada kondisi rakyat saat menjabat kasus bayi bernama raya yang meninggal karena cacingan kasus ribuan anak yang keracunan mbg dan masalah gaji guru yang selalu jadi angin lalu kamu diam bu,bicara perikemanusiaan adil adab pernah punya sensitivitas kondisi rakyat saat jabat kasus bayi nama raya tinggal cacing kasus ribu anak racun masalah gaji guru selalu angin lalu kamu diam
1963067101830066511,"@saturnevereturn How dare she said mbg shaky but bold...shaky...SHAKY...ratusan anak anak KERACUNAN, staff GAK DIGANI and thats shaky to u??????",zarilarsson,1183668989999730689,2025-09-03 02:30:43,6,0,0,0,1,667,in,general,mbg_umum_short,https://x.com/zarilarsson/status/1963067101830066511,how dare she said mbg shaky but bold shaky shaky ratusan anak anak keracunan staff gak digani and thats shaky to u,how dare she said shaky but bold shaky shaky ratus anak anak racun staff gani and thats shaky
1963569737239326906,@_Queen_Putri Merdeka 80 tahun masih ada yg seperti ini?. Mending dana utk MBG itu dipake utk bantu mereka..nangis aku ...apa arti kemerdekasn buat mereka?. @prabowo @gibran_tweet  @DPR_RI @mprgoid  @puanmaharani_ri  @smindrawatii  @Kemdikdasmen @KemensetnegRI,mmymurni,34194525,2025-09-04 11:48:01,0,0,0,0,0,49,in,general,mbg_umum_short,https://x.com/mmymurni/status/1963569737239326906,merdeka tahun masih ada yg seperti ini mending dana utk mbg itu dipake utk bantu mereka nangis aku apa arti kemerdekasn buat mereka,merdeka tahun masih ada seperti mending dana dipake bantu mereka nang aku apa arti kemerdekasn buat mereka
1963407544317256053,"@hnirankara Kebutuhannya untuk memenuhi ego2 kalian sendiri. MBG, IKN, KerCep dll. 

Bukannya cari cara nambah pendapatan dengan mempermudah iklim usaha dll, malah malak doang. Udah gitu pejabat tambah mewah 

Harusnya lu semua yang mutusin, lu semua yang nanggung lah. Simpel og",Ari_Berboedi,70039510,2025-09-04 01:03:31,0,0,0,0,0,9,in,general,mbg_umum_short,https://x.com/Ari_Berboedi/status/1963407544317256053,kebutuhannya untuk memenuhi ego kalian sendiri mbg ikn kercep dll bukannya cari cara nambah pendapatan dengan mempermudah iklim usaha dll malah malak doang udah gitu pejabat tambah mewah harusnya lu semua yang mutusin lu semua yang nanggung lah simpel og,butuh penuh ego kalian sendiri ikn kercep bukan cari cara nambah dapat mudah iklim usaha malah malak doang gitu jabat tambah mewah harus semua mutusin semua nanggung lah simpel
1963419341569101893,@kompascom Program mbg bisa dihentikan dulu ga bu? Jelas terlalu banyak nguras dana dan ga ada mutunya,anxiouuss,398052174,2025-09-04 01:50:24,0,0,0,0,0,9,in,general,mbg_umum_short,https://x.com/anxiouuss/status/1963419341569101893,program mbg bisa dihentikan dulu ga bu jelas terlalu banyak nguras dana dan ga ada mutunya,bisa henti dulu jelas terlalu banyak nguras dana ada mutu
1963514927240679444,@dikanchut ceo MBG dikacangin😭,urboyfriendrn,1278361679097524224,2025-09-04 08:10:13,1,0,0,0,0,161,in,general,mbg_umum_short,https://x.com/urboyfriendrn/status/1963514927240679444,ceo mbg dikacangin,ceo dikacangin
1963876356200002037,"yang minta IKN siapa?
yang minta kereta cepat siapa?
yang minta MBG siapa?",ghifarv,97615861,2025-09-05 08:06:25,0,0,0,0,0,80,in,general,mbg_umum_short,https://x.com/ghifarv/status/1963876356200002037,yang minta ikn siapa yang minta kereta cepat siapa yang minta mbg siapa,minta ikn siapa minta kereta cepat siapa minta siapa
1964015581365170254,"Makannya gw ngerasa aneh banget sama orang2 pro-barat terus yg suka muji2 ""bantuan dari barat""

bruh, gaada yg namanya makan siang gratis, MBG aja duitnya dari pajak.",kodosunofficial,1955205201784344578,2025-09-05 17:19:38,14,0,3,0,1,271,in,general,mbg_umum_short,https://x.com/kodosunofficial/status/1964015581365170254,makannya gw ngerasa aneh banget sama orang pro barat terus yg suka muji bantuan dari barat bruh gaada yg namanya makan siang gratis mbg aja duitnya dari pajak,makan ngerasa aneh banget sama orang pro barat terus suka muji bantu barat bruh gaada nama siang duit pajak
1964404806304612648,"@DokterTifa @prabowo Indonesia belum siap buat MBG, tapi terpaksa dilaksanakan karena 2 orang dungu telanjur umbar janji.",poetrapetiir,61134478,2025-09-06 19:06:17,1,0,0,0,0,45,in,general,mbg_umum_short,https://x.com/poetrapetiir/status/1964404806304612648,indonesia belum siap buat mbg tapi terpaksa dilaksanakan karena orang dungu telanjur umbar janji,indonesia siap buat paksa laksana orang dungu telanjur umbar janji
1964461016508780878,@txtdrimedia Kan yg masak dan nyalurin MBG katanya itu bagian dari 19jt lapangan pekerjaan,fucekboyinsyaf,1737151905720340480,2025-09-06 22:49:38,0,0,0,0,0,56,in,general,mbg_umum_short,https://x.com/fucekboyinsyaf/status/1964461016508780878,kan yg masak dan nyalurin mbg katanya itu bagian dari jt lapangan pekerjaan,masak nyalurin kata bagi lapang kerja
1964411284688162855,@infobdg MBG effort?,Janjijony442288,1885366744967241731,2025-09-06 19:32:01,0,0,0,0,0,54,in,general,mbg_umum_short,https://x.com/Janjijony442288/status/1964411284688162855,mbg effort,effort
1964652904469696574,"Pak @prabowo definisi bergizi yang sesungguhnya adalah seperti ini. Bukan seperti yang di MBG. Buang dana 1T lebih per hari kalau yang disajikan spt sekarang.
Dan kalau tdk bertahap sekolah membuat dapurnya sendiri, selamanya dana itu dikutip 20-25% oleh pihak 'middleman'. 250M lebih per hari!",BforBAM,26012425,2025-09-07 11:32:08,0,0,0,0,0,30,in,general,mbg_umum_short,https://x.com/BforBAM/status/1964652904469696574,pak definisi bergizi yang sesungguhnya adalah seperti ini bukan seperti yang di mbg buang dana t lebih per hari kalau yang disajikan spt sekarang dan kalau tdk bertahap sekolah membuat dapurnya sendiri selamanya dana itu dikutip oleh pihak middleman m lebih per hari,pak definisi sungguh adalah seperti bukan seperti buang dana lebih per hari saji spt sekarang tdk tahap sekolah buat dapur sendiri lama dana kutip oleh pihak middleman lebih per hari
1964564219975922079,"@GoodRecom Seandainya dana MBG digunakan utk buka usaha atau pabrik, atau mensubsidi petani dan nelayan kecil, ada jutaan orang tua yg bisa mendapatkan penghasilan yg layak sehingga mereka juga akan bisa menyediakan makanan bergizi utk keluarganya.
MBG membuang sia2 pajak rakyat  !",DefiraPutra,1966590001,2025-09-07 05:39:44,37,3,4,0,0,4989,in,general,mbg_umum_short,https://x.com/DefiraPutra/status/1964564219975922079,seandainya dana mbg digunakan utk buka usaha atau pabrik atau mensubsidi petani dan nelayan kecil ada jutaan orang tua yg bisa mendapatkan penghasilan yg layak sehingga mereka juga akan bisa menyediakan makanan bergizi utk keluarganya mbg membuang sia pajak rakyat,anda dana guna buka usaha pabrik subsidi tani nelayan kecil ada juta orang tua bisa dapat hasil layak sehingga mereka akan bisa sedia makan keluarga buang sia pajak rakyat
1964593286943035529,Berdosa banget pencetus mbg dan yang ikut menggembor2 kan program cacat ini,sundayayeah,4764005720,2025-09-07 07:35:14,2,0,1,0,0,181,in,general,mbg_umum_short,https://x.com/sundayayeah/status/1964593286943035529,berdosa banget pencetus mbg dan yang ikut menggembor kan program cacat ini,dosa banget cetus ikut gembor cacat
