tweet_id,text_raw,author_username,author_id,created_at,like_count,reply_count,repost_count,quote_count,bookmark_count,impression_count,lang,query_group,query_label,tweet_url,text_clean,text_joined
1960902968380907572,"Meksiko baru bangun 31 rumah sakit lagaknya udah kayak bangun negara aja, contoh lah Indonesia yang berani menganggarkan Makan Bergizi Gratis untuk 82.9 juta siswa dari anggaran pendidikan 😎😎😎",KemenperinRI,1030789552867139584,2025-08-28 03:11:14,12,0,0,0,1,397,in,general,mbg_umum_phrase,https://x.com/KemenperinRI/status/1960902968380907572,meksiko baru bangun rumah sakit lagaknya udah kayak bangun negara aja contoh lah indonesia yang berani menganggarkan makan bergizi gratis untuk juta siswa dari anggaran pendidikan,meksiko baru bangun rumah sakit lagak bangun negara contoh lah indonesia berani anggar juta siswa anggar didik
1961801423471177911,"@M45Broo_ TAPI KAN ADA MAKAN BERGIZI GRATIS, OOM",jokoprabowo88,1916319053599412226,2025-08-30 14:41:22,0,0,0,0,0,205,in,general,mbg_umum_phrase,https://x.com/jokoprabowo88/status/1961801423471177911,tapi kan ada makan bergizi gratis oom,ada oom
1973340097560060040,"Menteri Hak Asasi Manusia (HAM) Natalius Pigai menegaskan program Makan Bergizi Gratis (MBG) yang digagas pemerintahan Presiden Prabowo Subianto dan Wakil Presiden Gibran Rakabuming Raka telah berjalan baik. Dari total sekira 31 juta penerima manfaat, hanya tercatat deviasi atau penyimpangan 0,0017 persen.

“Secara keseluruhan, sesungguhnya 99% pelaksanaan makan bergisi gratis sampai pada hari ini berhasil. Yang deviasi atau penyimpangan itu hanya 0,0017%. Jadi 99,99% makan bergizi gratis di Indonesia yang baru seumur jagung termasuk berhasil sampai pada hari ini,” kata Pigai saat konferensi pers di Kementerian HAM, Jakarta Selatan, Rabu 1 Oktober 2025.

Meski capaian itu dinilai luar biasa, Pigai mengakui program ini masih butuh pemantapan, revitalisasi, pengawasan, peningkatan keterampilan, hingga rekrutmen tenaga terampil agar keberlangsungan MBG semakin optimal.

“Diharapkan perlu ada pemantapan, perlu ada revitalisasi, perlu ada pengawasan, perlu ada peningkatan skills, perlu ada rekrutmen, tenaga-tenaga terampil yang nanti bisa ikut memberi kontribusi di dalam pelaksanaan makan bergizi gratis untuk masa yang akan datang,” tutur Pigai.

***

Asep Bidin Rosidin/PRMN",pikiran_rakyat,58880688,2025-10-01 10:51:56,0,1,0,0,0,478,in,general,mbg_umum_phrase,https://x.com/pikiran_rakyat/status/1973340097560060040,menteri hak asasi manusia ham natalius pigai menegaskan program makan bergizi gratis mbg yang digagas pemerintahan presiden prabowo subianto dan wakil presiden gibran rakabuming raka telah berjalan baik dari total sekira juta penerima manfaat hanya tercatat deviasi atau penyimpangan persen secara keseluruhan sesungguhnya pelaksanaan makan bergisi gratis sampai pada hari ini berhasil yang deviasi atau penyimpangan itu hanya jadi makan bergizi gratis di indonesia yang baru seumur jagung termasuk berhasil sampai pada hari ini kata pigai saat konferensi pers di kementerian ham jakarta selatan rabu oktober meski capaian itu dinilai luar biasa pigai mengakui program ini masih butuh pemantapan revitalisasi pengawasan peningkatan keterampilan hingga rekrutmen tenaga terampil agar keberlangsungan mbg semakin optimal diharapkan perlu ada pemantapan perlu ada revitalisasi perlu ada pengawasan perlu ada peningkatan skills perlu ada rekrutmen tenaga tenaga terampil yang nanti bisa ikut memberi kontribusi di dalam pelaksanaan makan bergizi gratis untuk masa yang akan datang tutur pigai asep bidin rosidin prmn,menteri hak asasi manusia ham natalius pigai tegas gagas perintah presiden prabowo subianto wakil presiden gibran rakabuming raka telah jalan baik total sekira juta terima manfaat hanya catat deviasi simpang persen cara seluruh sungguh laksana bergisi sampai hari hasil deviasi simpang hanya indonesia baru umur jagung masuk hasil sampai hari kata pigai saat konferensi pers menteri ham jakarta selatan rabu oktober meski capai nilai luar biasa pigai aku masih butuh mantap revitalisasi awas tingkat terampil hingga rekrutmen tenaga terampil agar langsung makin optimal harap perlu ada mantap perlu ada revitalisasi perlu ada awas perlu ada tingkat skills perlu ada rekrutmen tenaga tenaga terampil nanti bisa ikut beri kontribusi dalam laksana masa akan datang tutur pigai asep bidin rosidin prmn
1962144461322133580,"@thinkboutcheol that adidas terex haha, kayaknya mereka yang perlu makan bergizi gratis for their brain biar berkembang, setan juga minder liat kelakuan lo orang",coeca1ne,1403488092695138313,2025-08-31 13:24:29,1,0,0,0,0,429,in,general,mbg_umum_phrase,https://x.com/coeca1ne/status/1962144461322133580,that adidas terex haha kayaknya mereka yang perlu makan bergizi gratis for their brain biar berkembang setan juga minder liat kelakuan lo orang,that adidas terex haha kayak mereka perlu their brain kembang setan minder liat laku orang
1963933395064668420,"@perupadata Bahaya sih kalau perimbangannya korupsi. Yang bikin program Makan Bergizi Gratis suatu saat bisa juga dong diciduk kalau programnya gak jalan.

Belum lagi Food Estate.",IndoBebasKKN,58707803,2025-09-05 11:53:04,2,0,0,0,1,389,in,general,mbg_umum_phrase,https://x.com/IndoBebasKKN/status/1963933395064668420,bahaya sih kalau perimbangannya korupsi yang bikin program makan bergizi gratis suatu saat bisa juga dong diciduk kalau programnya gak jalan belum lagi food estate,bahaya imbang korupsi bikin suatu saat bisa ciduk program jalan food estate
1958890894993891786,"Menteri Keuangan Sri Mulyani mengoreksi anggaran pendidikan di APBN 2026. Besaran alokasi  Makan Bergizi Gratis (MBG) yang sebelumnya mencapai 44 persen dari total Anggaran Pendidikan senilai Rp757,8 triliun, turun hingga 29 persen sebesar Rp223,6 triliun. Sementara, alokasi anggaran untuk tunjangan bagi guru serta dosen naik Rp96 triliun.

Meski alokasinya turun, porsi anggaran untuk MBG tetap Rp335 triliun. Kekurangannya diambil dari anggaran kesehatan Rp24,7 triliun, anggaran fungsi ekonomi Rp19,7 triliun, serta anggaran cadangan Rp67 triliun.

Baca selengkapnya https://t.co/iRusvM0miK

-

Selengkapnya kunjungi website dengan klik link di bio atau download aplikasi di AppStore dan Google Play Store.

#InilahNews #AnggaranPendidikan #APBN2026 #Inilahcom #titiktengah #titikcerah",inilahdotcom,46693036,2025-08-22 13:55:58,0,0,0,0,0,223,in,general,mbg_umum_phrase,https://x.com/inilahdotcom/status/1958890894993891786,menteri keuangan sri mulyani mengoreksi anggaran pendidikan di apbn besaran alokasi makan bergizi gratis mbg yang sebelumnya mencapai persen dari total anggaran pendidikan senilai rp triliun turun hingga persen sebesar rp triliun sementara alokasi anggaran untuk tunjangan bagi guru serta dosen naik rp triliun meski alokasinya turun porsi anggaran untuk mbg tetap rp triliun kekurangannya diambil dari anggaran kesehatan rp triliun anggaran fungsi ekonomi rp triliun serta anggaran cadangan rp triliun baca selengkapnya selengkapnya kunjungi website dengan klik link di bio atau download aplikasi di appstore dan google play store inilahnews anggaranpendidikan apbn inilahcom titiktengah titikcerah,menteri uang sri mulyani koreksi anggar didik apbn besar alokasi belum capai persen total anggar didik nila triliun turun hingga persen besar triliun sementara alokasi anggar tunjang bagi guru serta dosen naik triliun meski alokasi turun porsi anggar tetap triliun kurang ambil anggar sehat triliun anggar fungsi ekonomi triliun serta anggar cadang triliun baca lengkap lengkap kunjung website klik link bio download aplikasi appstore google play store inilahnews anggaranpendidikan apbn inilahcom titiktengah titikcerah
1959883640432652462,"@ardisatriawan korban jadi berkurang ✅
nambah korban baru ✅

MBG :
• Makan Bergizi Gratis ❎
• Makan Beracun Gratis ✅ https://t.co/ceGynxUJmn",mbadog_,1677842828670697472,2025-08-25 07:40:47,141,7,7,1,3,9383,in,general,mbg_umum_phrase,https://x.com/mbadog_/status/1959883640432652462,korban jadi berkurang nambah korban baru mbg makan bergizi gratis makan beracun gratis,korban kurang nambah korban baru racun
1965757479532519647,@txtdrimedia Program makan bergizi gratis perkuat ekonomi UMKM lokal https://t.co/6uSXt5ncC0,Kanzia_92,1047153853,2025-09-10 12:41:19,2,0,0,0,1,327,in,general,mbg_umum_phrase,https://x.com/Kanzia_92/status/1965757479532519647,program makan bergizi gratis perkuat ekonomi umkm lokal,kuat ekonomi umkm lokal
1972847679991697761,"Program Makan Bergizi Gratis (MBG) yang dimaksudkan memberikan akses makanan bergizi, justru meracuni. Murid diberikan makanan basi. Program ini juga bias gender, sejumlah laporan sebut relawan dapur sempat tak dibayar. Keterlibatan militer sangat kental sejak hulu hingga hilir. 

https://t.co/AjvxJrkoCt

Tim Edisi Khusus 
Koordinator: Luthfi Maulana Adhari
Peliput: Anita Dhewy dan Luthfi Maulana Adhari
Riset & Pemetaan: Luthfi Maulana Adhari
Editor: Luviana Ariyanti

Liputan ini merupakan bagian dari Edisi Khusus https://t.co/7M6NyBtoFY edisi September 2025 yang menyajikan reportase dan jurnalisme data gender terkait Program Makan Bergizi Gratis (MBG) yang dicanangkan oleh Presiden RI, Prabowo Subianto, sejak Januari 2025.

#EdisiKhususKondeco #MakanBergiziGratis #OkeGasAwasiRezimPrabowo",konde_co,1269826533096448001,2025-09-30 02:15:15,28,1,14,0,3,688,in,general,mbg_umum_phrase,https://x.com/konde_co/status/1972847679991697761,program makan bergizi gratis mbg yang dimaksudkan memberikan akses makanan bergizi justru meracuni murid diberikan makanan basi program ini juga bias gender sejumlah laporan sebut relawan dapur sempat tak dibayar keterlibatan militer sangat kental sejak hulu hingga hilir tim edisi khusus koordinator luthfi maulana adhari peliput anita dhewy dan luthfi maulana adhari riset pemetaan luthfi maulana adhari editor luviana ariyanti liputan ini merupakan bagian dari edisi khusus edisi september yang menyajikan reportase dan jurnalisme data gender terkait program makan bergizi gratis mbg yang dicanangkan oleh presiden ri prabowo subianto sejak januari edisikhususkondeco makanbergizigratis okegasawasirezimprabowo,maksud beri akses makan justru racun murid beri makan basi bias gender jumlah lapor sebut rawan dapur sempat tak bayar libat militer sangat kental sejak hulu hingga hilir tim edisi khusus koordinator luthfi maulana adhari liput anita dhewy luthfi maulana adhari riset meta luthfi maulana adhari editor luviana ariyanti liput rupa bagi edisi khusus edisi september saji reportase jurnalisme data gender kait canang oleh presiden prabowo subianto sejak januari edisikhususkondeco makanbergizigratis okegasawasirezimprabowo
1959962142615994426,"@ardisatriawan Makan Bergizi Gratis kok endingnya masuk IGD massal? 🤦‍♂️
Ini bukan sekadar “keracunan”, tapi bukti bobroknya sistem pengawasan makanan publik.
Jangan-jangan program cuma ngejar pencitraan, tapi nyawa rakyat dikorbankan!
#KeracunanMBG #Sleman",unyunyum,1951122799915155456,2025-08-25 12:52:43,1,1,0,0,0,172,in,general,mbg_umum_phrase,https://x.com/unyunyum/status/1959962142615994426,makan bergizi gratis kok endingnya masuk igd massal ini bukan sekadar keracunan tapi bukti bobroknya sistem pengawasan makanan publik jangan jangan program cuma ngejar pencitraan tapi nyawa rakyat dikorbankan keracunanmbg sleman,endingnya masuk igd massal bukan sekadar racun bukti bobrok sistem awas makan publik jangan jangan cuma ngejar citra nyawa rakyat korban keracunanmbg sleman
1969016467682193731,"🔴LIVE NOW
🎬: https://t.co/VWRSwj7w2s

SAATNYA KITA BICARA SOAL PROGRAM MAKAN BERGIZI GRATIS, APA PERLU DIBERHENTIKAN ATAU DIEVALUASI???",tilehopper,1249662133916192768,2025-09-19 12:31:23,10,0,3,0,0,1620,in,general,mbg_umum_phrase,https://x.com/tilehopper/status/1969016467682193731,live now saatnya kita bicara soal program makan bergizi gratis apa perlu diberhentikan atau dievaluasi,live now saat kita bicara soal apa perlu henti evaluasi
1971085551328690547,Ratusan Siswa SMP di Rembang Diduga Keracunan Massal Usai Santap Makan Bergizi Gratis https://t.co/AbSNBbhR3S,arrahmah,43872781,2025-09-25 05:33:11,6,0,5,0,0,595,in,general,mbg_umum_phrase,https://x.com/arrahmah/status/1971085551328690547,ratusan siswa smp di rembang diduga keracunan massal usai santap makan bergizi gratis,ratus siswa smp rembang duga racun massal usai santap
1971013231679524887,"teledor katanya der

Kepala Badan Gizi Nasional (BGN), Dadan Hindayana, menganggap kasus keracunan massal yang menimpa ratusan pelajar di Kecamatan Cipongkor, Bandung Barat, sebagai sebuah ""keteledoran"". Hal ini disampaikannya setelah meninjau langsung lokasi dapur program Makan Bergizi Gratis (MBG) di wilayah tersebut.

""Kondisinya sebenarnya bagus, hanya mungkin ada keteledoran,"" kata Dadan saat menjenguk para korban. la menduga insiden ini disebabkan oleh banyak Satuan Pelayanan Pemenuhan Gizi (SPPG) yang baru beroperasi dan belum terbiasa mengolah makanan dalam jumlah besar.

Dadan menambahkan, seharusnya SPPG baru memulai dengan skala kecil, melayani satu atau dua sekolah terlebih dahulu sebelum melayani dalam jumlah besar. ""Sepertinya yang (SPPG) ini dia berusaha untuk dalam jumlah besar di awal. Jadi itu ada kesalahan teknis,"" jelasnya.

Sebagai langkah antisipasi, Dadan menginstruksikan agar makanan diolah tidak lebih dari 4-5 jam sebelum disajikan. la juga menekankan pentingnya menggunakan bahan baku berkualitas dari pemasok yang terpercaya.

Meskipun terjadi insiden, Dadan mengapresiasi kesigapan petugas dalam menangani korban dan meminta seluruh wilayah lain untuk mempersiapkan posko penanganan serupa. la mencatat bahwa rata-rata korban mengalami gejala pusing dan mual, yang menurutnya adalah indikasi dari ""salah konsumsi.""

Source: CNN Indonesia",Jateng_Twit,785145642,2025-09-25 00:45:48,108,13,9,4,3,13722,in,general,mbg_umum_phrase,https://x.com/Jateng_Twit/status/1971013231679524887,teledor katanya der kepala badan gizi nasional bgn dadan hindayana menganggap kasus keracunan massal yang menimpa ratusan pelajar di kecamatan cipongkor bandung barat sebagai sebuah keteledoran hal ini disampaikannya setelah meninjau langsung lokasi dapur program makan bergizi gratis mbg di wilayah tersebut kondisinya sebenarnya bagus hanya mungkin ada keteledoran kata dadan saat menjenguk para korban la menduga insiden ini disebabkan oleh banyak satuan pelayanan pemenuhan gizi sppg yang baru beroperasi dan belum terbiasa mengolah makanan dalam jumlah besar dadan menambahkan seharusnya sppg baru memulai dengan skala kecil melayani satu atau dua sekolah terlebih dahulu sebelum melayani dalam jumlah besar sepertinya yang sppg ini dia berusaha untuk dalam jumlah besar di awal jadi itu ada kesalahan teknis jelasnya sebagai langkah antisipasi dadan menginstruksikan agar makanan diolah tidak lebih dari jam sebelum disajikan la juga menekankan pentingnya menggunakan bahan baku berkualitas dari pemasok yang terpercaya meskipun terjadi insiden dadan mengapresiasi kesigapan petugas dalam menangani korban dan meminta seluruh wilayah lain untuk mempersiapkan posko penanganan serupa la mencatat bahwa rata rata korban mengalami gejala pusing dan mual yang menurutnya adalah indikasi dari salah konsumsi source cnn indonesia,teledor kata der kepala badan gizi nasional bgn dad hindayana anggap kasus racun massal timpa ratus ajar camat cipongkor bandung barat bagai buah teledor hal sampai telah tinjau langsung lokasi dapur wilayah sebut kondisi benar bagus hanya mungkin ada teledor kata dad saat jenguk para korban duga insiden sebab oleh banyak satu layan penuh gizi baru operasi biasa olah makan dalam jumlah besar dad tambah harus baru mulai skala kecil layan satu dua sekolah lebih dahulu belum layan dalam jumlah besar seperti dia usaha dalam jumlah besar awal ada salah teknis jelas bagai langkah antisipasi dad instruksi agar makan olah tidak lebih jam belum saji tekan penting guna bahan baku kualitas pasok percaya meski jadi insiden dad apresiasi sigap tugas dalam tangan korban minta seluruh wilayah lain siap posko tangan rupa catat bahwa rata rata korban alami gejala pusing mual turut adalah indikasi salah konsumsi source cnn indonesia
1972281114166534653,"Dewan Pers mendorong Biro Pers Istana memberi penjelasan terkait pencabutan ID Card wartawan CNN Indonesia, Diana Valencia. Ketua Dewan Pers Komaruddin Hidayat mengingatkan agar semua pihak menjunjung tinggi kemerdekaan pers sesuai UU Nomor 40 Tahun 1999.

Mereka meminta akses liputan jurnalis CNN segera dipulihkan agar tidak menghambat tugas jurnalistik di Istana. Dewan Pers juga menegaskan kasus serupa tak boleh terulang demi menjaga iklim kebebasan pers di Indonesia.

AJI Jakarta dan LBH Pers mengecam pencabutan ID tersebut yang terjadi usai pertanyaan DV kepada Presiden Prabowo tentang program Makan Bergizi Gratis (MBG). Mereka menilai tindakan itu melanggar UU Pers serta hak publik untuk memperoleh informasi.

AJI dan LBH Pers mendesak pengembalian ID Pers Istana, meminta evaluasi pejabat Biro Pers, serta menegaskan kerja jurnalis dilindungi undang-undang. PWI Pusat juga menyatakan keprihatinan, menyebut pencabutan itu berpotensi menghambat kemerdekaan pers dan bertentangan dengan UUD 1945 serta UU Pers.

Ketua Umum PWI Akhmad Munir menekankan, pertanyaan di luar agenda tidak bisa dijadikan alasan pembatasan. Ia mendorong Biro Pers Istana segera memberi klarifikasi resmi, karena menjaga kemerdekaan pers berarti menjaga demokrasi.

📸: Dok. kumparan/Luthfi Human. 

Follow WhatsApp Channel kumparan untuk dapat Informasi terpercaya dikirim langsung ke WhatsApp kamu. Ketik https://t.co/LTFgN0m78w di browser kamu sekarang, agar bisa share informasi tanpa ragu. 

#newsupdate #update #news #oneliner #wartawan #jurnalis #istana #dewanpers #pencabutanid #prabowo #info #infoterkini #berita #beritaterkini #bicarafaktalewatberita #kumparan",kumparan,759692754985242625,2025-09-28 12:43:55,1206,56,553,31,48,67251,in,general,mbg_umum_phrase,https://x.com/kumparan/status/1972281114166534653,dewan pers mendorong biro pers istana memberi penjelasan terkait pencabutan id card wartawan cnn indonesia diana valencia ketua dewan pers komaruddin hidayat mengingatkan agar semua pihak menjunjung tinggi kemerdekaan pers sesuai uu nomor tahun mereka meminta akses liputan jurnalis cnn segera dipulihkan agar tidak menghambat tugas jurnalistik di istana dewan pers juga menegaskan kasus serupa tak boleh terulang demi menjaga iklim kebebasan pers di indonesia aji jakarta dan lbh pers mengecam pencabutan id tersebut yang terjadi usai pertanyaan dv kepada presiden prabowo tentang program makan bergizi gratis mbg mereka menilai tindakan itu melanggar uu pers serta hak publik untuk memperoleh informasi aji dan lbh pers mendesak pengembalian id pers istana meminta evaluasi pejabat biro pers serta menegaskan kerja jurnalis dilindungi undang undang pwi pusat juga menyatakan keprihatinan menyebut pencabutan itu berpotensi menghambat kemerdekaan pers dan bertentangan dengan uud serta uu pers ketua umum pwi akhmad munir menekankan pertanyaan di luar agenda tidak bisa dijadikan alasan pembatasan ia mendorong biro pers istana segera memberi klarifikasi resmi karena menjaga kemerdekaan pers berarti menjaga demokrasi dok kumparan luthfi human follow whatsapp channel kumparan untuk dapat informasi terpercaya dikirim langsung ke whatsapp kamu ketik di browser kamu sekarang agar bisa share informasi tanpa ragu newsupdate update news oneliner wartawan jurnalis istana dewanpers pencabutanid prabowo info infoterkini berita beritaterkini bicarafaktalewatberita kumparan,dewan pers dorong biro pers istana beri jelas kait cabut card wartawan cnn indonesia ana valencia ketua dewan pers komaruddin hidayat ingat agar semua pihak junjung tinggi merdeka pers sesuai nomor tahun mereka minta akses liput jurnalis cnn segera pulih agar tidak hambat tugas jurnalistik istana dewan pers tegas kasus rupa tak boleh ulang demi jaga iklim bebas pers indonesia aji jakarta lbh pers kecam cabut sebut jadi usai tanya kepada presiden prabowo tentang mereka nilai tindak langgar pers serta hak publik oleh informasi aji lbh pers desak kembali pers istana minta evaluasi jabat biro pers serta tegas kerja jurnalis lindung undang undang pwi pusat nyata prihatin sebut cabut potensi hambat merdeka pers tentang uud serta pers ketua umum pwi akhmad munir tekan tanya luar agenda tidak bisa jadi alas batas dorong biro pers istana segera beri klarifikasi resmi jaga merdeka pers arti jaga demokrasi dok kumpar luthfi human follow whatsapp channel kumpar dapat informasi percaya kirim langsung whatsapp kamu ketik browser kamu sekarang agar bisa share informasi tanpa ragu newsupdate update news oneliner wartawan jurnalis istana dewanpers pencabutanid prabowo info infoterkini berita beritaterkini bicarafaktalewatberita kumpar
1973543955188031820,Anggota DPR RI Irma Suryani Chaniago mengusulkan agar nama Makan Bergizi Gratis (MBG) diubah jadi Makan Bergizi tanpa pakai kata 'gratis' karena konotasinya dinilai negatif https://t.co/15s4aRYWwM,txtdrimedia,1300484934449000448,2025-10-02 00:22:00,209,103,29,22,16,23825,in,general,mbg_umum_phrase,https://x.com/txtdrimedia/status/1973543955188031820,anggota dpr ri irma suryani chaniago mengusulkan agar nama makan bergizi gratis mbg diubah jadi makan bergizi tanpa pakai kata gratis karena konotasinya dinilai negatif,anggota dpr irma suryani chaniago usul agar nama ubah tanpa pakai kata konotasi nilai negatif
1962317338122060208,"@CurutBengak Jujur udah masuk usia kepala 4 baru liat demo yang kekbeginian.
Amang mantap rezim Makan Bergizi Gratis (MBG) ini😀",hawaveg95500,1962122476202369024,2025-09-01 00:51:26,0,0,0,0,0,108,in,general,mbg_umum_phrase,https://x.com/hawaveg95500/status/1962317338122060208,jujur udah masuk usia kepala baru liat demo yang kekbeginian amang mantap rezim makan bergizi gratis mbg ini,jujur masuk usia kepala baru liat demo kekbeginian amang mantap rezim
1958671106711462113,"Selamat pagi para beban negara!

Siap untuk kerja keras hari ini?

Menu sudah disiapkan untuk keluarga beban negara:

1) Ayah bekerja dengan UMR pas-pasan gak cukup untuk hidup.

2) Karena masih kurang, kerja jadi ojol, dengan hak-haknya disunat aplikator.

3) Ibu harus bantu demi keluarga survive, gak cukup.

4) Jadi guru honorer, ratusan ribu sebulan. Kata Menteri, ""Apakah semua harus ditanggung negara?""

5) Kakak baru masuk kuliah, dapet UKT tinggi, gak dapet KIPK. Katanya total penghasilan keluarga udah di atas batas miskin.

6) Batas miskinnya udah dibikin 20 ribu sehari, kata BPS, biar gak banyak yang miskin.

7) Adik sekolah, Ayah Ibu gak siapin sarapan, udah berangkat kerja dua-duanya.

8) Tapi tenang, di sekolah ada Makan Bergizi Gratis. Setengah anggaran pendidikan.

9) Tapi siangnya adik pucat, dibawa pulang sama Bu Guru. Keracunan katanya.

10) Dibawa ke rumah sakit, tapi BPJS gak terurus, ribet urus administrasi. Adik makin pucat.

Dasar kalian beban negara.

Oh kalian udah terima penghasilan kalian?

Jangan lupa pajak penghasilan.

Jangan cuma jadi beban negara.",ardisatriawan,170542374,2025-08-21 23:22:36,2734,73,1119,27,151,55127,in,general,mbg_umum_phrase,https://x.com/ardisatriawan/status/1958671106711462113,selamat pagi para beban negara siap untuk kerja keras hari ini menu sudah disiapkan untuk keluarga beban negara ayah bekerja dengan umr pas pasan gak cukup untuk hidup karena masih kurang kerja jadi ojol dengan hak haknya disunat aplikator ibu harus bantu demi keluarga survive gak cukup jadi guru honorer ratusan ribu sebulan kata menteri apakah semua harus ditanggung negara kakak baru masuk kuliah dapet ukt tinggi gak dapet kipk katanya total penghasilan keluarga udah di atas batas miskin batas miskinnya udah dibikin ribu sehari kata bps biar gak banyak yang miskin adik sekolah ayah ibu gak siapin sarapan udah berangkat kerja dua duanya tapi tenang di sekolah ada makan bergizi gratis setengah anggaran pendidikan tapi siangnya adik pucat dibawa pulang sama bu guru keracunan katanya dibawa ke rumah sakit tapi bpjs gak terurus ribet urus administrasi adik makin pucat dasar kalian beban negara oh kalian udah terima penghasilan kalian jangan lupa pajak penghasilan jangan cuma jadi beban negara,selamat pagi para beban negara siap kerja keras hari menu siap keluarga beban negara ayah kerja umr pas pas cukup hidup masih kurang kerja ojol hak hak sunat aplikator ibu harus bantu demi keluarga survive cukup guru honorer ratus ribu bulan kata menteri apakah semua harus tanggung negara kakak baru masuk kuliah dapet ukt tinggi dapet kipk kata total hasil keluarga atas batas miskin batas miskin bikin ribu hari kata bps banyak miskin adik sekolah ayah ibu siapin sarap berangkat kerja dua dua tenang sekolah ada tengah anggar didik siang adik pucat bawa pulang sama guru racun kata bawa rumah sakit bpjs urus ribet urus administrasi adik makin pucat dasar kalian beban negara kalian terima hasil kalian jangan lupa pajak hasil jangan cuma beban negara
1970820809682989177,"Menteri Koordinator Bidang Pemberdayaan Masyarakat Muhaimin Iskandar atau Cak Imin memastikan program makan bergizi gratis (MBG) tidak akan dihentikan.

Klik untuk baca: https://t.co/DEzjV7O9dA

| #MakanBergiziGratis #CakImin https://t.co/HoNXJciLcZ",kompascom,23343960,2025-09-24 12:01:11,208,332,91,108,16,67836,in,general,mbg_umum_phrase,https://x.com/kompascom/status/1970820809682989177,menteri koordinator bidang pemberdayaan masyarakat muhaimin iskandar atau cak imin memastikan program makan bergizi gratis mbg tidak akan dihentikan klik untuk baca makanbergizigratis cakimin,menteri koordinator bidang daya masyarakat muhaimin iskandar cak imin pasti tidak akan henti klik baca makanbergizigratis cakimin
